00:00.0 Host bridge [0600]: Intel Corporation 440FX - 82441FX PMC [Natoma] [8086:1237] (rev 02)
	Subsystem: Red Hat, Inc. Qemu virtual machine [1af4:1100]
	Control: I/O+ Mem+ BusMaster- SpecCycle- MemWINV- VGASnoop- ParErr- Stepping- SERR+ FastB2B- DisINTx-
	Status: Cap- 66MHz- UDF- FastB2B- ParErr- DEVSEL=fast >TAbort- <TAbort- <MAbort- >SERR- <PERR- INTx-

00:01.0 ISA bridge [0601]: Intel Corporation 82371SB PIIX3 ISA [Natoma/Triton II] [8086:7000]
	Subsystem: Red Hat, Inc. Qemu virtual machine [1af4:1100]
	Control: I/O+ Mem+ BusMaster- SpecCycle- MemWINV- VGASnoop- ParErr- Stepping- SERR+ FastB2B- DisINTx-
	Status: Cap- 66MHz- UDF- FastB2B- ParErr- DEVSEL=medium >TAbort- <TAbort- <MAbort- >SERR- <PERR- INTx-

00:01.1 IDE interface [0101]: Intel Corporation 82371SB PIIX3 IDE [Natoma/Triton II] [8086:7010] (prog-if 80 [ISA Compatibility mode-only controller, supports bus mastering])
	Subsystem: Red Hat, Inc. Qemu virtual machine [1af4:1100]
	Control: I/O+ Mem+ BusMaster+ SpecCycle- MemWINV- VGASnoop- ParErr- Stepping- SERR+ FastB2B- DisINTx-
	Status: Cap- 66MHz- UDF- FastB2B+ ParErr- DEVSEL=medium >TAbort- <TAbort- <MAbort- >SERR- <PERR- INTx-
	Latency: 0
	Region 0: Memory at 000001f0 (32-bit, non-prefetchable) [virtual] [size=8]
	Region 1: Memory at 000003f0 (type 3, non-prefetchable) [virtual]
	Region 2: Memory at 00000170 (32-bit, non-prefetchable) [virtual] [size=8]
	Region 3: Memory at 00000370 (type 3, non-prefetchable) [virtual]
	Region 4: I/O ports at c500 [virtual] [size=16]
	Kernel driver in use: ata_piix

00:01.3 Bridge [0680]: Intel Corporation 82371AB/EB/MB PIIX4 ACPI [8086:7113] (rev 03)
	Subsystem: Red Hat, Inc. Qemu virtual machine [1af4:1100]
	Control: I/O+ Mem+ BusMaster- SpecCycle- MemWINV- VGASnoop- ParErr- Stepping- SERR+ FastB2B- DisINTx-
	Status: Cap- 66MHz- UDF- FastB2B+ ParErr- DEVSEL=medium >TAbort- <TAbort- <MAbort- >SERR- <PERR- INTx-
	Interrupt: pin A routed to IRQ 9

00:02.0 VGA compatible controller [0300]: Red Hat, Inc. QXL paravirtual graphic card [1b36:0100] (rev 05) (prog-if 00 [VGA controller])
	Subsystem: Red Hat, Inc. QEMU Virtual Machine [1af4:1100]
	Control: I/O+ Mem+ BusMaster- SpecCycle- MemWINV- VGASnoop- ParErr- Stepping- SERR+ FastB2B- DisINTx-
	Status: Cap- 66MHz- UDF- FastB2B- ParErr- DEVSEL=fast >TAbort- <TAbort- <MAbort- >SERR- <PERR- INTx-
	Interrupt: pin A routed to IRQ 10
	Region 0: Memory at f4000000 (32-bit, non-prefetchable) [size=64M]
	Region 1: Memory at f8000000 (32-bit, non-prefetchable) [size=64M]
	Region 2: Memory at fc114000 (32-bit, non-prefetchable) [size=8K]
	Region 3: I/O ports at c440 [size=32]
	Expansion ROM at 000c0000 [disabled] [size=128K]
	Kernel driver in use: qxl
	Kernel modules: qxl

00:03.0 SCSI storage controller [0100]: Red Hat, Inc. Virtio block device [1af4:1001]
	Subsystem: Red Hat, Inc. Virtio block device [1af4:0002]
	Physical Slot: 3
	Control: I/O+ Mem+ BusMaster+ SpecCycle- MemWINV- VGASnoop- ParErr- Stepping- SERR+ FastB2B- DisINTx+
	Status: Cap+ 66MHz- UDF- FastB2B- ParErr- DEVSEL=fast >TAbort- <TAbort- <MAbort- >SERR- <PERR- INTx-
	Latency: 0
	Interrupt: pin A routed to IRQ 11
	Region 0: I/O ports at c000 [size=128]
	Region 1: Memory at fc116000 (32-bit, non-prefetchable) [size=4K]
	Region 4: Memory at febcc000 (64-bit, prefetchable) [size=16K]
	Capabilities: [98] MSI-X: Enable+ Count=33 Masked-
		Vector table: BAR=1 offset=00000000
		PBA: BAR=1 offset=00000800
	Capabilities: [84] Vendor Specific Information: VirtIO: <unknown>
		BAR=0 offset=00000000 size=00000000
	Capabilities: [70] Vendor Specific Information: VirtIO: Notify
		BAR=4 offset=00003000 size=00001000 multiplier=00000004
	Capabilities: [60] Vendor Specific Information: VirtIO: DeviceCfg
		BAR=4 offset=00002000 size=00001000
	Capabilities: [50] Vendor Specific Information: VirtIO: ISR
		BAR=4 offset=00001000 size=00001000
	Capabilities: [40] Vendor Specific Information: VirtIO: CommonCfg
		BAR=4 offset=00000000 size=00001000
	Kernel driver in use: virtio-pci

00:04.0 Audio device [0403]: Intel Corporation 82801FB/FBM/FR/FW/FRW (ICH6 Family) High Definition Audio Controller [8086:2668] (rev 01)
	Subsystem: Red Hat, Inc. QEMU Virtual Machine [1af4:1100]
	Physical Slot: 4
	Control: I/O+ Mem+ BusMaster+ SpecCycle- MemWINV- VGASnoop- ParErr- Stepping- SERR+ FastB2B- DisINTx+
	Status: Cap+ 66MHz- UDF- FastB2B- ParErr- DEVSEL=fast >TAbort- <TAbort- <MAbort- >SERR- <PERR- INTx-
	Latency: 0
	Interrupt: pin A routed to IRQ 263
	Region 0: Memory at fc110000 (32-bit, non-prefetchable) [size=16K]
	Capabilities: [60] MSI: Enable+ Count=1/1 Maskable- 64bit+
		Address: 00000000fee19000  Data: 0027
	Kernel driver in use: snd_hda_intel
	Kernel modules: snd_hda_intel

00:05.0 Communication controller [0780]: Red Hat, Inc. Virtio console [1af4:1003]
	Subsystem: Red Hat, Inc. Virtio console [1af4:0003]
	Physical Slot: 5
	Control: I/O+ Mem+ BusMaster+ SpecCycle- MemWINV- VGASnoop- ParErr- Stepping- SERR+ FastB2B- DisINTx+
	Status: Cap+ 66MHz- UDF- FastB2B- ParErr- DEVSEL=fast >TAbort- <TAbort- <MAbort- >SERR- <PERR- INTx-
	Latency: 0
	Interrupt: pin A routed to IRQ 10
	Region 0: I/O ports at c380 [size=64]
	Region 1: Memory at fc117000 (32-bit, non-prefetchable) [size=4K]
	Region 4: Memory at febd0000 (64-bit, prefetchable) [size=16K]
	Capabilities: [98] MSI-X: Enable+ Count=2 Masked-
		Vector table: BAR=1 offset=00000000
		PBA: BAR=1 offset=00000800
	Capabilities: [84] Vendor Specific Information: VirtIO: <unknown>
		BAR=0 offset=00000000 size=00000000
	Capabilities: [70] Vendor Specific Information: VirtIO: Notify
		BAR=4 offset=00003000 size=00001000 multiplier=00000004
	Capabilities: [60] Vendor Specific Information: VirtIO: DeviceCfg
		BAR=4 offset=00002000 size=00001000
	Capabilities: [50] Vendor Specific Information: VirtIO: ISR
		BAR=4 offset=00001000 size=00001000
	Capabilities: [40] Vendor Specific Information: VirtIO: CommonCfg
		BAR=4 offset=00000000 size=00001000
	Kernel driver in use: virtio-pci

00:06.0 USB controller [0c03]: Intel Corporation 82801I (ICH9 Family) USB UHCI Controller #1 [8086:2934] (rev 03) (prog-if 00 [UHCI])
	Subsystem: Red Hat, Inc. QEMU Virtual Machine [1af4:1100]
	Control: I/O+ Mem+ BusMaster+ SpecCycle- MemWINV- VGASnoop- ParErr- Stepping- SERR+ FastB2B- DisINTx-
	Status: Cap- 66MHz- UDF- FastB2B- ParErr- DEVSEL=fast >TAbort- <TAbort- <MAbort- >SERR- <PERR- INTx-
	Latency: 0
	Interrupt: pin A routed to IRQ 10
	Region 4: I/O ports at c460 [size=32]
	Kernel driver in use: uhci_hcd

00:06.1 USB controller [0c03]: Intel Corporation 82801I (ICH9 Family) USB UHCI Controller #2 [8086:2935] (rev 03) (prog-if 00 [UHCI])
	Subsystem: Red Hat, Inc. QEMU Virtual Machine [1af4:1100]
	Control: I/O+ Mem+ BusMaster+ SpecCycle- MemWINV- VGASnoop- ParErr- Stepping- SERR+ FastB2B- DisINTx-
	Status: Cap- 66MHz- UDF- FastB2B- ParErr- DEVSEL=fast >TAbort- <TAbort- <MAbort- >SERR- <PERR- INTx-
	Latency: 0
	Interrupt: pin B routed to IRQ 11
	Region 4: I/O ports at c480 [size=32]
	Kernel driver in use: uhci_hcd

00:06.2 USB controller [0c03]: Intel Corporation 82801I (ICH9 Family) USB UHCI Controller #3 [8086:2936] (rev 03) (prog-if 00 [UHCI])
	Subsystem: Red Hat, Inc. QEMU Virtual Machine [1af4:1100]
	Control: I/O+ Mem+ BusMaster+ SpecCycle- MemWINV- VGASnoop- ParErr- Stepping- SERR+ FastB2B- DisINTx-
	Status: Cap- 66MHz- UDF- FastB2B- ParErr- DEVSEL=fast >TAbort- <TAbort- <MAbort- >SERR- <PERR- INTx-
	Latency: 0
	Interrupt: pin C routed to IRQ 11
	Region 4: I/O ports at c4a0 [size=32]
	Kernel driver in use: uhci_hcd

00:06.7 USB controller [0c03]: Intel Corporation 82801I (ICH9 Family) USB2 EHCI Controller #1 [8086:293a] (rev 03) (prog-if 20 [EHCI])
	Subsystem: Red Hat, Inc. QEMU Virtual Machine [1af4:1100]
	Control: I/O+ Mem+ BusMaster+ SpecCycle- MemWINV- VGASnoop- ParErr- Stepping- SERR+ FastB2B- DisINTx-
	Status: Cap- 66MHz- UDF- FastB2B- ParErr- DEVSEL=fast >TAbort- <TAbort- <MAbort- >SERR- <PERR- INTx-
	Latency: 0, Cache Line Size: 64 bytes
	Interrupt: pin D routed to IRQ 10
	Region 0: Memory at fc118000 (32-bit, non-prefetchable) [size=4K]
	Kernel driver in use: ehci-pci

00:07.0 Ethernet controller [0200]: Red Hat, Inc. Virtio network device [1af4:1000]
	Subsystem: Red Hat, Inc. Virtio network device [1af4:0001]
	Physical Slot: 7
	Control: I/O+ Mem+ BusMaster+ SpecCycle- MemWINV- VGASnoop- ParErr- Stepping- SERR+ FastB2B- DisINTx+
	Status: Cap+ 66MHz- UDF- FastB2B- ParErr- DEVSEL=fast >TAbort- <TAbort- <MAbort- >SERR- <PERR- INTx-
	Latency: 0
	Interrupt: pin A routed to IRQ 11
	Region 0: I/O ports at c4c0 [size=32]
	Region 1: Memory at fc119000 (32-bit, non-prefetchable) [size=4K]
	Region 4: Memory at febd4000 (64-bit, prefetchable) [size=16K]
	Expansion ROM at fc000000 [disabled] [size=512K]
	Capabilities: [98] MSI-X: Enable+ Count=4 Masked-
		Vector table: BAR=1 offset=00000000
		PBA: BAR=1 offset=00000800
	Capabilities: [84] Vendor Specific Information: VirtIO: <unknown>
		BAR=0 offset=00000000 size=00000000
	Capabilities: [70] Vendor Specific Information: VirtIO: Notify
		BAR=4 offset=00003000 size=00001000 multiplier=00000004
	Capabilities: [60] Vendor Specific Information: VirtIO: DeviceCfg
		BAR=4 offset=00002000 size=00001000
	Capabilities: [50] Vendor Specific Information: VirtIO: ISR
		BAR=4 offset=00001000 size=00001000
	Capabilities: [40] Vendor Specific Information: VirtIO: CommonCfg
		BAR=4 offset=00000000 size=00001000
	Kernel driver in use: virtio-pci

00:08.0 SCSI storage controller [0100]: Red Hat, Inc. Virtio block device [1af4:1001]
	Subsystem: Red Hat, Inc. Virtio block device [1af4:0002]
	Physical Slot: 8
	Control: I/O+ Mem+ BusMaster+ SpecCycle- MemWINV- VGASnoop- ParErr- Stepping- SERR+ FastB2B- DisINTx+
	Status: Cap+ 66MHz- UDF- FastB2B- ParErr- DEVSEL=fast >TAbort- <TAbort- <MAbort- >SERR- <PERR- INTx-
	Latency: 0
	Interrupt: pin A routed to IRQ 11
	Region 0: I/O ports at c080 [size=128]
	Region 1: Memory at fc11a000 (32-bit, non-prefetchable) [size=4K]
	Region 4: Memory at febd8000 (64-bit, prefetchable) [size=16K]
	Capabilities: [98] MSI-X: Enable+ Count=33 Masked-
		Vector table: BAR=1 offset=00000000
		PBA: BAR=1 offset=00000800
	Capabilities: [84] Vendor Specific Information: VirtIO: <unknown>
		BAR=0 offset=00000000 size=00000000
	Capabilities: [70] Vendor Specific Information: VirtIO: Notify
		BAR=4 offset=00003000 size=00001000 multiplier=00000004
	Capabilities: [60] Vendor Specific Information: VirtIO: DeviceCfg
		BAR=4 offset=00002000 size=00001000
	Capabilities: [50] Vendor Specific Information: VirtIO: ISR
		BAR=4 offset=00001000 size=00001000
	Capabilities: [40] Vendor Specific Information: VirtIO: CommonCfg
		BAR=4 offset=00000000 size=00001000
	Kernel driver in use: virtio-pci

00:09.0 Unclassified device [00ff]: Red Hat, Inc. Virtio memory balloon [1af4:1002]
	Subsystem: Red Hat, Inc. Virtio memory balloon [1af4:0005]
	Physical Slot: 9
	Control: I/O+ Mem+ BusMaster+ SpecCycle- MemWINV- VGASnoop- ParErr- Stepping- SERR+ FastB2B- DisINTx-
	Status: Cap+ 66MHz- UDF- FastB2B- ParErr- DEVSEL=fast >TAbort- <TAbort- <MAbort- >SERR- <PERR- INTx-
	Latency: 0
	Interrupt: pin A routed to IRQ 10
	Region 0: I/O ports at c3c0 [size=64]
	Region 4: Memory at febdc000 (64-bit, prefetchable) [size=16K]
	Capabilities: [84] Vendor Specific Information: VirtIO: <unknown>
		BAR=0 offset=00000000 size=00000000
	Capabilities: [70] Vendor Specific Information: VirtIO: Notify
		BAR=4 offset=00003000 size=00001000 multiplier=00000004
	Capabilities: [60] Vendor Specific Information: VirtIO: DeviceCfg
		BAR=4 offset=00002000 size=00001000
	Capabilities: [50] Vendor Specific Information: VirtIO: ISR
		BAR=4 offset=00001000 size=00001000
	Capabilities: [40] Vendor Specific Information: VirtIO: CommonCfg
		BAR=4 offset=00000000 size=00001000
	Kernel driver in use: virtio-pci

00:0a.0 Ethernet controller [0200]: Red Hat, Inc. Virtio network device [1af4:1000]
	Subsystem: Red Hat, Inc. Virtio network device [1af4:0001]
	Physical Slot: 10
	Control: I/O+ Mem+ BusMaster+ SpecCycle- MemWINV- VGASnoop- ParErr- Stepping- SERR+ FastB2B- DisINTx+
	Status: Cap+ 66MHz- UDF- FastB2B- ParErr- DEVSEL=fast >TAbort- <TAbort- <MAbort- >SERR- <PERR- INTx-
	Latency: 0
	Interrupt: pin A routed to IRQ 10
	Region 0: I/O ports at c4e0 [size=32]
	Region 1: Memory at fc11b000 (32-bit, non-prefetchable) [size=4K]
	Region 4: Memory at febe0000 (64-bit, prefetchable) [size=16K]
	Expansion ROM at fc080000 [disabled] [size=512K]
	Capabilities: [98] MSI-X: Enable+ Count=4 Masked-
		Vector table: BAR=1 offset=00000000
		PBA: BAR=1 offset=00000800
	Capabilities: [84] Vendor Specific Information: VirtIO: <unknown>
		BAR=0 offset=00000000 size=00000000
	Capabilities: [70] Vendor Specific Information: VirtIO: Notify
		BAR=4 offset=00003000 size=00001000 multiplier=00000004
	Capabilities: [60] Vendor Specific Information: VirtIO: DeviceCfg
		BAR=4 offset=00002000 size=00001000
	Capabilities: [50] Vendor Specific Information: VirtIO: ISR
		BAR=4 offset=00001000 size=00001000
	Capabilities: [40] Vendor Specific Information: VirtIO: CommonCfg
		BAR=4 offset=00000000 size=00001000
	Kernel driver in use: virtio-pci

00:0b.0 SCSI storage controller [0100]: Red Hat, Inc. Virtio block device [1af4:1001]
	Subsystem: Red Hat, Inc. Virtio block device [1af4:0002]
	Physical Slot: 11
	Control: I/O+ Mem+ BusMaster+ SpecCycle- MemWINV- VGASnoop- ParErr- Stepping- SERR+ FastB2B- DisINTx+
	Status: Cap+ 66MHz- UDF- FastB2B- ParErr- DEVSEL=fast >TAbort- <TAbort- <MAbort- >SERR- <PERR- INTx-
	Latency: 0
	Interrupt: pin A routed to IRQ 11
	Region 0: I/O ports at c100 [size=128]
	Region 1: Memory at fc11c000 (32-bit, non-prefetchable) [size=4K]
	Region 4: Memory at febe4000 (64-bit, prefetchable) [size=16K]
	Capabilities: [98] MSI-X: Enable+ Count=33 Masked-
		Vector table: BAR=1 offset=00000000
		PBA: BAR=1 offset=00000800
	Capabilities: [84] Vendor Specific Information: VirtIO: <unknown>
		BAR=0 offset=00000000 size=00000000
	Capabilities: [70] Vendor Specific Information: VirtIO: Notify
		BAR=4 offset=00003000 size=00001000 multiplier=00000004
	Capabilities: [60] Vendor Specific Information: VirtIO: DeviceCfg
		BAR=4 offset=00002000 size=00001000
	Capabilities: [50] Vendor Specific Information: VirtIO: ISR
		BAR=4 offset=00001000 size=00001000
	Capabilities: [40] Vendor Specific Information: VirtIO: CommonCfg
		BAR=4 offset=00000000 size=00001000
	Kernel driver in use: virtio-pci

00:0c.0 SCSI storage controller [0100]: Red Hat, Inc. Virtio block device [1af4:1001]
	Subsystem: Red Hat, Inc. Virtio block device [1af4:0002]
	Physical Slot: 12
	Control: I/O+ Mem+ BusMaster+ SpecCycle- MemWINV- VGASnoop- ParErr- Stepping- SERR+ FastB2B- DisINTx+
	Status: Cap+ 66MHz- UDF- FastB2B- ParErr- DEVSEL=fast >TAbort- <TAbort- <MAbort- >SERR- <PERR- INTx-
	Latency: 0
	Interrupt: pin A routed to IRQ 11
	Region 0: I/O ports at c180 [size=128]
	Region 1: Memory at fc11d000 (32-bit, non-prefetchable) [size=4K]
	Region 4: Memory at febe8000 (64-bit, prefetchable) [size=16K]
	Capabilities: [98] MSI-X: Enable+ Count=33 Masked-
		Vector table: BAR=1 offset=00000000
		PBA: BAR=1 offset=00000800
	Capabilities: [84] Vendor Specific Information: VirtIO: <unknown>
		BAR=0 offset=00000000 size=00000000
	Capabilities: [70] Vendor Specific Information: VirtIO: Notify
		BAR=4 offset=00003000 size=00001000 multiplier=00000004
	Capabilities: [60] Vendor Specific Information: VirtIO: DeviceCfg
		BAR=4 offset=00002000 size=00001000
	Capabilities: [50] Vendor Specific Information: VirtIO: ISR
		BAR=4 offset=00001000 size=00001000
	Capabilities: [40] Vendor Specific Information: VirtIO: CommonCfg
		BAR=4 offset=00000000 size=00001000
	Kernel driver in use: virtio-pci

00:0d.0 SCSI storage controller [0100]: Red Hat, Inc. Virtio block device [1af4:1001]
	Subsystem: Red Hat, Inc. Virtio block device [1af4:0002]
	Physical Slot: 13
	Control: I/O+ Mem+ BusMaster+ SpecCycle- MemWINV- VGASnoop- ParErr- Stepping- SERR+ FastB2B- DisINTx+
	Status: Cap+ 66MHz- UDF- FastB2B- ParErr- DEVSEL=fast >TAbort- <TAbort- <MAbort- >SERR- <PERR- INTx-
	Latency: 0
	Interrupt: pin A routed to IRQ 10
	Region 0: I/O ports at c200 [size=128]
	Region 1: Memory at fc11e000 (32-bit, non-prefetchable) [size=4K]
	Region 4: Memory at febec000 (64-bit, prefetchable) [size=16K]
	Capabilities: [98] MSI-X: Enable+ Count=33 Masked-
		Vector table: BAR=1 offset=00000000
		PBA: BAR=1 offset=00000800
	Capabilities: [84] Vendor Specific Information: VirtIO: <unknown>
		BAR=0 offset=00000000 size=00000000
	Capabilities: [70] Vendor Specific Information: VirtIO: Notify
		BAR=4 offset=00003000 size=00001000 multiplier=00000004
	Capabilities: [60] Vendor Specific Information: VirtIO: DeviceCfg
		BAR=4 offset=00002000 size=00001000
	Capabilities: [50] Vendor Specific Information: VirtIO: ISR
		BAR=4 offset=00001000 size=00001000
	Capabilities: [40] Vendor Specific Information: VirtIO: CommonCfg
		BAR=4 offset=00000000 size=00001000
	Kernel driver in use: virtio-pci

00:0e.0 SCSI storage controller [0100]: Red Hat, Inc. Virtio SCSI [1af4:1004]
	Subsystem: Red Hat, Inc. Virtio SCSI [1af4:0008]
	Physical Slot: 14
	Control: I/O+ Mem+ BusMaster+ SpecCycle- MemWINV- VGASnoop- ParErr- Stepping- SERR+ FastB2B- DisINTx-
	Status: Cap+ 66MHz- UDF- FastB2B- ParErr- DEVSEL=fast >TAbort- <TAbort- <MAbort- >SERR- <PERR- INTx-
	Latency: 0
	Interrupt: pin A routed to IRQ 10
	Region 0: I/O ports at c400 [size=64]
	Region 1: Memory at fc11f000 (32-bit, non-prefetchable) [size=4K]
	Region 4: Memory at febf0000 (64-bit, prefetchable) [size=16K]
	Capabilities: [98] MSI-X: Enable- Count=35 Masked-
		Vector table: BAR=1 offset=00000000
		PBA: BAR=1 offset=00000800
	Capabilities: [84] Vendor Specific Information: VirtIO: <unknown>
		BAR=0 offset=00000000 size=00000000
	Capabilities: [70] Vendor Specific Information: VirtIO: Notify
		BAR=4 offset=00003000 size=00001000 multiplier=00000004
	Capabilities: [60] Vendor Specific Information: VirtIO: DeviceCfg
		BAR=4 offset=00002000 size=00001000
	Capabilities: [50] Vendor Specific Information: VirtIO: ISR
		BAR=4 offset=00001000 size=00001000
	Capabilities: [40] Vendor Specific Information: VirtIO: CommonCfg
		BAR=4 offset=00000000 size=00001000
	Kernel driver in use: virtio-pci

00:0f.0 SCSI storage controller [0100]: Red Hat, Inc. Virtio block device [1af4:1001]
	Subsystem: Red Hat, Inc. Virtio block device [1af4:0002]
	Physical Slot: 15
	Control: I/O+ Mem+ BusMaster+ SpecCycle- MemWINV- VGASnoop- ParErr- Stepping- SERR+ FastB2B- DisINTx+
	Status: Cap+ 66MHz- UDF- FastB2B- ParErr- DEVSEL=fast >TAbort- <TAbort- <MAbort- >SERR- <PERR- INTx-
	Latency: 0
	Interrupt: pin A routed to IRQ 11
	Region 0: I/O ports at c280 [size=128]
	Region 1: Memory at fc120000 (32-bit, non-prefetchable) [size=4K]
	Region 4: Memory at febf4000 (64-bit, prefetchable) [size=16K]
	Capabilities: [98] MSI-X: Enable+ Count=33 Masked-
		Vector table: BAR=1 offset=00000000
		PBA: BAR=1 offset=00000800
	Capabilities: [84] Vendor Specific Information: VirtIO: <unknown>
		BAR=0 offset=00000000 size=00000000
	Capabilities: [70] Vendor Specific Information: VirtIO: Notify
		BAR=4 offset=00003000 size=00001000 multiplier=00000004
	Capabilities: [60] Vendor Specific Information: VirtIO: DeviceCfg
		BAR=4 offset=00002000 size=00001000
	Capabilities: [50] Vendor Specific Information: VirtIO: ISR
		BAR=4 offset=00001000 size=00001000
	Capabilities: [40] Vendor Specific Information: VirtIO: CommonCfg
		BAR=4 offset=00000000 size=00001000
	Kernel driver in use: virtio-pci

00:10.0 SCSI storage controller [0100]: Red Hat, Inc. Virtio block device [1af4:1001]
	Subsystem: Red Hat, Inc. Virtio block device [1af4:0002]
	Physical Slot: 16
	Control: I/O+ Mem+ BusMaster+ SpecCycle- MemWINV- VGASnoop- ParErr- Stepping- SERR+ FastB2B- DisINTx+
	Status: Cap+ 66MHz- UDF- FastB2B- ParErr- DEVSEL=fast >TAbort- <TAbort- <MAbort- >SERR- <PERR- INTx-
	Latency: 0
	Interrupt: pin A routed to IRQ 11
	Region 0: I/O ports at c300 [size=128]
	Region 1: Memory at fc121000 (32-bit, non-prefetchable) [size=4K]
	Region 4: Memory at febf8000 (64-bit, prefetchable) [size=16K]
	Capabilities: [98] MSI-X: Enable+ Count=33 Masked-
		Vector table: BAR=1 offset=00000000
		PBA: BAR=1 offset=00000800
	Capabilities: [84] Vendor Specific Information: VirtIO: <unknown>
		BAR=0 offset=00000000 size=00000000
	Capabilities: [70] Vendor Specific Information: VirtIO: Notify
		BAR=4 offset=00003000 size=00001000 multiplier=00000004
	Capabilities: [60] Vendor Specific Information: VirtIO: DeviceCfg
		BAR=4 offset=00002000 size=00001000
	Capabilities: [50] Vendor Specific Information: VirtIO: ISR
		BAR=4 offset=00001000 size=00001000
	Capabilities: [40] Vendor Specific Information: VirtIO: CommonCfg
		BAR=4 offset=00000000 size=00001000
	Kernel driver in use: virtio-pci

00:11.0 Unclassified device [00ff]: Red Hat, Inc. Device [1af4:105b] (rev 01)
	Subsystem: Red Hat, Inc. Device [1af4:1100]
	Physical Slot: 17
	Control: I/O+ Mem+ BusMaster+ SpecCycle- MemWINV- VGASnoop- ParErr- Stepping- SERR+ FastB2B- DisINTx-
	Status: Cap+ 66MHz- UDF- FastB2B- ParErr- DEVSEL=fast >TAbort- <TAbort- <MAbort- >SERR- <PERR- INTx-
	Latency: 0
	Interrupt: pin A routed to IRQ 10
	Region 4: Memory at febfc000 (64-bit, prefetchable) [size=16K]
	Capabilities: [84] Vendor Specific Information: VirtIO: <unknown>
		BAR=0 offset=00000000 size=00000000
	Capabilities: [70] Vendor Specific Information: VirtIO: Notify
		BAR=4 offset=00003000 size=00001000 multiplier=00000004
	Capabilities: [60] Vendor Specific Information: VirtIO: DeviceCfg
		BAR=4 offset=00002000 size=00001000
	Capabilities: [50] Vendor Specific Information: VirtIO: ISR
		BAR=4 offset=00001000 size=00001000
	Capabilities: [40] Vendor Specific Information: VirtIO: CommonCfg
		BAR=4 offset=00000000 size=00001000
	Kernel driver in use: virtio-pci

